Phenotype,Network_score
"Mental and behavioral disorders due to use of other stimulants including caffeine, unspecified mental and behavioral disorder",3.592344732092682e-06
"maternal mental disorder complicating pregnancy, second trimester",3.5767113292373635e-06
Perinatal disorder of growth and/or development,3.561815729846082e-06
"Motor vehicle traffic accident unspecified, passenger of motor vehicle injured",3.5386106829744046e-06
"Car passenger injured in collision with two- or three-wheeled motor vehicle in nontraffic accident, initial encounter",3.5361260532862047e-06
down regulation of protein sequestering,3.511134720123666e-06
Unspecified subluxation of right sternoclavicular joint,3.468813996934188e-06
Giant cell tumour of tendon sheath benign,3.466154103340364e-06
"ANHIDROSIS, ISOLATED, WITH NORMAL SWEAT GLANDS",3.4506167551593336e-06
Nonestrogen-Dependent Malignant Neoplasm,3.402011384169003e-06
Organic emotionally labile disorder,3.3701564929134082e-06
"Displaced midcervical fracture of unspecified femur, subsequent encounter for closed fracture with nonunion",3.3192423810883254e-06
"Military operation involving nuclear radiation effects of nuclear weapon, military personnel",3.2870129287141774e-06
Multiple Nucleotide Abnormalities,3.2361153139903067e-06
Bilateral hypoplasia,3.2188309472191377e-06
Neoplasms of the Mouse Intestinal Tract,3.2101810135067174e-06
"Hodgkin disease, lymphocyte depletion, reticular of central nervous system",3.207947208417352e-06
Acute bilateral thrombosis of subclavian veins,3.193802497561781e-06
contusion with intact skin of left breast,3.178650512070003e-06
tuberculosis of left main bronchus,3.160227588011436e-06
"Military operations involving gasoline bomb, civilian, subsequent encounter",3.134785032813025e-06
adiaspiromycosis,3.1310469047183026e-06
"Contact with steam and hot vapors, undetermined intent, initial encounter",3.126099144811945e-06
B-cell lymphoma with features intermediate between diffuse large B-cell lymphoma and Burkitt lymphoma,3.126099144811945e-06
"Diabetes mellitus without mention of complication, type I [juvenile type], uncontrolled",3.088948916562726e-06
Retained foreign body in ankle region,3.0787317316528823e-06
"Polyhydramnios, second trimester, other fetus",3.05225789669374e-06
"Unspecified injury of plantar artery of right foot, initial encounter",3.039939401199735e-06
"open fracture of skull with subarachnoid, subdural, or extradural hemorrhage with no loss of consciousness",3.035549835552901e-06
Lymphatic (small vessel) invasion by tumor absent,3.0212884434035713e-06
Enamel and dentine fracture,2.9996371125186937e-06
"Chronic gout due to renal impairment, unspecified ankle and foot, without tophus (tophi)",2.938421908048761e-06
Acquired Encephalocele,2.917098538061155e-06
Other specified acquired deformities of unspecified upper arm,2.9147728003962382e-06
PAS Positive,2.9147728003962382e-06
Hereditary edema of legs,2.8994155405165044e-06
Boric acid adverse reaction,2.843899550783798e-06
immunoblastic large B-cell diffuse lymphoma of gallbladder,2.813787041685849e-06
constrictive bronchiolitis obliterans,2.8098623074417545e-06
diabetes with diabetic chronic kidney disease,2.797656699187926e-06
Motor vehicle traffic accident involving collision with other vehicle injuring unspecified person,2.7647892655746044e-06
McDonough syndrome,2.7353248891825575e-06
aneurysm of right inferior renal artery,2.7282811491596673e-06
Intermittent monocular exotropia of right eye,2.7282811491596673e-06
"stricture; nasopharynx, syphilitic (manifestation)",2.69377695397916e-06
Bone Malalignment,2.675200063512832e-06
"Degeneration of pupillary margin, bilateral",2.673974425560541e-06
"Displaced fracture (avulsion) of lateral epicondyle of right humerus, subsequent encounter for fracture with nonunion",2.673974425560541e-06
Fall on same level due to nature of surface,2.6045049790825677e-06
Pain with supination of forearm against resistance,2.6045049790825677e-06
Drostanolone propionate allergy,2.6045049790825677e-06
"Hypodontia, X-linked",2.5007278436822384e-06
Nonparathyroid neoplasms,2.4774385486745735e-06
Cerebellar lesion NOS,2.467052009921998e-06
"Mental and behavioral disorders due to use of cocaine, amnesic syndrome",2.4482345321936157e-06
"Glaucoma with increased episcleral venous pressure, unspecified eye",2.4410774190155013e-06
Bladder Angiosarcoma,2.430021718234742e-06
"Periprosthetic fracture around internal prosthetic right elbow joint, sequela",2.430021718234742e-06
gout of left glenohumeral joint,2.40080354445347e-06
Thyroid: [enlargement] or [goitre NOS],2.3978592729521828e-06
"Nondisplaced intraarticular fracture of right calcaneus, sequela",2.390105990920866e-06
late effects of nontraumatic subarachnoid hemorrhage bilateral paralysis,2.3897810302031126e-06
AOD impairment,2.3897810302031126e-06
Class IV antiarrhythmic overdose,2.3897810302031126e-06
"bronchitis; acute or subacute, due to Hemophilus influenzae",2.3897810302031126e-06
"Other injury of extensor muscle, fascia and tendon of left ring finger at wrist and hand level, initial encounter",2.3897810302031126e-06
ADENOMAS AND ADENOCARCINOMAS,2.383620729629299e-06
Candidiasis: [oral and oesophagus] or [pharyngeal],2.3749941529806207e-06
"injury; nerve, spinal, root, with multiple body regions",2.3748793953587856e-06
(Aleukemic leukemia) or (leukemia - unspec cell NOS),2.370133428521736e-06
Psychoactive substance abuse,2.370133428521736e-06
fear of cancer of the musculoskeletal system,2.278161904381765e-06
"fibrosis due to nervous system device, implant, or graft",2.2772466661027397e-06
lacrimal passage granuloma of right eye,2.275879398137899e-06
Primary Insomnia,2.275879398137899e-06
Pericellular fibrosis of congenital syphilis,2.275879398137899e-06
CONDITIONS OF FETAL GROWTH AND MALNUTRITION,2.241802525855942e-06
Congenital aplasia of genital organs,2.2361462521359307e-06
Sulfamethoxazole + trimethoprim adverse reaction,2.2361462521359307e-06
"PEROXISOME BIOGENESIS DISORDER, COMPLEMENTATION GROUP 5",2.2054001134488017e-06
"Dislocation of tarsometatarsal joint of left foot, initial encounter",2.163024730143276e-06
neoplasm of autonomic nerves of groin,2.163024730143276e-06
ankle strain,2.163024730143276e-06
Accidental methylphenobarbitone overdose,2.1472074254414262e-06
Mycobacterium avium complex immune restoration disease,2.141491640430407e-06
"Displaced avulsion fracture of tuberosity of right calcaneus, subsequent encounter for fracture with malunion",2.1173427003306655e-06
"Follicular lymphoma grade IIIb, intrathoracic lymph nodes",2.114555417441744e-06
Viral hemorrhagic cystitis,2.1117365485565625e-06
"Laceration without foreign body of left lesser toe(s) without damage to nail, initial encounter",2.1011246654890735e-06
"Person boarding or alighting a car injured in collision with van, initial encounter",2.091201028164947e-06
Ova & parasites identified&#x7C;Prid&#x7C;Sys:ANYResp,2.0811436215514947e-06
"Collapsed vertebra, not elsewhere classified, sacral and sacrococcygeal region, subsequent encounter for fracture with delayed healing",2.0811436215514947e-06
"Spontaneous rupture of extensor tendons, right ankle and foot",2.0811436215514947e-06
Crushing injury of unspecified thumb,2.0615992126860886e-06
"operative; injury, pneumothorax, accidental puncture or laceration",2.048694797330235e-06
Dexamethasone suppression test positive,2.032022190990015e-06
goblet cell carcinoid of small intestine,2.03149852472881e-06
"Tuberculosis of larynx, trachea and bronchus, without mention of bacteriological or histological confirmation",2.0157797578793837e-06
Hyphema of iris and ciliary body,2.0039881791464298e-06
"Type I occipital condyle fracture, unspecified side, initial encounter for closed fracture",2.0039881791464298e-06
Cellulitis of right eyelid,2.0039881791464298e-06
Rat Malignant Meningioma,2.0039881791464298e-06
pathologic fracture of navicular of left foot,2.0039881791464298e-06
angioimmunoblastic T-cell lymphoma of oral cavity,2.0039881791464298e-06
Continent ileostomy complication,2.0039881791464298e-06
closed fracture of right acetabulum with dislocation of posterior femoral head,2.0039881791464298e-06
Chronic endophthalmitis of left eye,2.0039881791464298e-06
"gender dysphoria of adulthood, previously asexual",2.0039881791464298e-06
"c.surgical procedure; cardiac, functional or late",1.9620927993278992e-06
COLON SIGMOID VOLVULUS RECURRENT,1.9620927993278992e-06
Abdominal aortic aneurysm greater than 5.5 centimeters in male,1.9570614946848733e-06
Postprocedural seroma of ear and mastoid process following a procedure on the ear and mastoid process,1.921142656791374e-06
KERATOCONJUNCTIVITIS SICCA WITH XEROSTOMIA,1.9040869499015172e-06
desmoplastic melanoma of orbit,1.903400433569897e-06
neoplasm of left first costal cartilage,1.8749738232780384e-06
"Juvenile rheumatoid arthritis, ankle and foot",1.855769550816068e-06
"Falling, jumping or pushed from a high place, undetermined intent causing accidental injury",1.8285997277992738e-06
Dissociative neurological symptom disorder co-occurrent with chorea,1.7909906762845674e-06
small B-cell lymphocytic lymphoma of digestive tract,1.7909906762845674e-06
"Other injury of other specified muscles, fascia and tendons at wrist and hand level, left hand, subsequent encounter",1.7909906762845674e-06
maternal alcohol use complicating pregnancy,1.7886492078112191e-06
Swan-neck deformity of finger of left hand,1.7815689194224831e-06
"Other secondary chronic gout, unspecified knee, with tophus (tophi)",1.7666888334766818e-06
sympathetic uveitis of left eye,1.7666888334766818e-06
"Other injury of flexor muscle, fascia and tendon of left index finger at wrist and hand level, initial encounter",1.7642546790142708e-06
UNIQUE GREEN PHENOMENON,1.7613916230632204e-06
"anaplastic large cell lymphoma, null cell type of cerebral ventricle",1.7613916230632204e-06
secondary pigmentary peripheral retinal degeneration of left eye,1.7392053685715564e-06
Rudd Klimek syndrome,1.7365361944064772e-06
"Acute and subacute allergic otitis media (mucoid) (sanguinous) (serous), recurrent, bilateral",1.7241368483366352e-06
"Other secondary chronic gout, right knee, with tophus (tophi)",1.7191065312052442e-06
Atrioventricular nodal function,1.7156738644313068e-06
HYPOTRICHOSIS 11,1.7156738644313068e-06
neoplasm; myelopathy (manifestation),1.7156738644313068e-06
"Noncollision motor vehicle traffic accident involving being hit by object thrown into or on motor vehicle while in motion, passenger of motor vehicle injured",1.7142648284946543e-06
"Unspecified motorcycle rider injured in noncollision transport accident in traffic accident, sequela",1.7049067407266883e-06
postprocedural circulatory system seroma following a procedure,1.68962127574603e-06
Meningovascular syphilis,1.6557550186770105e-06
"Fracture of unspecified part of neck of unspecified femur, subsequent encounter for open fracture type IIIA, IIIB, or IIIC with delayed healing",1.6455895919640383e-06
Displaced fracture of epiphysis (separation) (upper) of right femur,1.6378722250416653e-06
Clear cell papillary renal cell carcinoma,1.6288925837335727e-06
T wave height,1.624898234427172e-06
Laceration of skin of hand,1.6122371890907476e-06
grade 3 follicular lymphoma of stomach,1.6122371890907476e-06
traumatic arthritis of second toe of right foot,1.6060728161119507e-06
Nondisplaced fracture of navicular [scaphoid] of unspecified foot,1.5690852350505383e-06
Other carcinoma in situ of breast,1.550091531963843e-06
Cardiac Biphasic Synovial Sarcoma,1.5384509032179552e-06
"War operations involving explosion of guided missile, civilian, initial encounter",1.5314493169093502e-06
Recurrent Kidney Medullary Carcinoma,1.5020316607485877e-06
glomerulonephritis with exudative nephritis,1.4957037738937154e-06
late onset schizophrenia in remission,1.450620526234799e-06
"X chromosome, trisomy Xq25",1.4062813584119235e-06
Pedestrian with other conveyance injured in collision with pedal cycle in nontraffic accident,1.4062813584119235e-06
"Laceration of other specified muscles and tendons at ankle and foot level, unspecified foot, sequela",1.3890372238057013e-06
Pimozide overdose of undetermined intent,1.3430324480054067e-06
"Nontraffic accident involving breakage of part of off-road motor vehicle, except snow vehicle, motor cyclist injured",1.3430324480054067e-06
Encephalomyelopathy,1.3428632629832664e-06
Guthrie test positive,1.3133449399891804e-06
"Zygomatic fracture, left side, subsequent encounter for fracture with routine healing",1.3089281248796804e-06
Bladder Well Differentiated Neuroendocrine Tumor,1.307208299970766e-06
"Complete traumatic amputation of foot, level unspecified",1.3060071040152057e-06
Other specified disorders of right external ear,1.2971344948363002e-06
"Nontraffic accident involving injury by being thrown against part of,or object in, moving motor vehicle, except off-road vehicle, not on highway, driver of motor vehicle injured",1.2868604130983795e-06
"Other specified crystal arthropathies, pelvic region and thigh",1.2659500438802603e-06
traumatic arthritis of fingers of right hand,1.2653043621777496e-06
c.medical procedure; vascular,1.2577907973835209e-06
End-diastolic pulmonary regurgitation velocity,1.2519273727854503e-06
"Diseases of the respiratory system complicating pregnancy, second trimester",1.2429456582594725e-06
mucositis of bladder,1.241557500691222e-06
"Tributary (branch) retinal vein occlusion, right eye, stable",1.241557500691222e-06
Dactinomycin overdose of undetermined intent,1.2116519071381228e-06
CATARACT ENLARGEMENT,1.2114062800722581e-06
neoplasm of tendon sheath,1.2114062800722581e-06
neoplasm of soft tissue of abdominal wall,1.2103543440702341e-06
rampant caries of dentin,1.1918568379391709e-06
"Laceration with foreign body, unspecified hip, sequela",1.1811262641850299e-06
Allergy to bufexamac,1.1798110352382858e-06
N-ACETYLASPARTATE DEFICIENCY,1.17424829450384e-06
Diffuse mixed small and large cell lymphoma (Adult T-cell lymphoma/leukemia) stage IV,1.1658518771219382e-06
Superficial spreading malignant melanoma of skin,1.1652884147241363e-06
"displacement of gastrointestinal prosthetic device, implant, or graft",1.1444226176337066e-06
Unspecified sprain of other and unspecified finger(s),1.1293967931976253e-06
allergy testing rabbit meat induration,1.1258540893552148e-06
Juvenile Myoclonic Epilepsy,1.122005768674168e-06
"tobacco; intoxication, toxic effect",1.1142772188433005e-06
Accident involving land yacht,1.1122186505417005e-06
"Open bite of unspecified toe(s) with damage to nail, sequela",1.1077838677485112e-06
Keratitis caused by infection,1.0718207270243263e-06
disorder of lacrimal system of left eye,1.0710455096229339e-06
"Other war operations occurring after cessation of hostilities, military personnel, sequela",1.049766409398492e-06
"Laceration without foreign body, unspecified hip, sequela",1.0415570214287157e-06
defense response to protozoan,1.0405094676292065e-06
endophthalmitis; candidiasis (manifestation),1.0342098040502284e-06
"spinal cord; malposition, congenital",1.0340572822900728e-06
Amikacin adverse reaction,1.030040482038435e-06
Disorder of thermoreceptive pit organ,1.0182159235245657e-06
"Chorioretinal scars after surgery for detachment, right eye",1.0105128852616347e-06
Monosomy 22,9.90172075859581e-07
"Fracture of coronoid process of right mandible, subsequent encounter for fracture with nonunion",9.809481146345514e-07
Other disorders of white blood cells,9.78773045600668e-07
Nitrogen dioxide poisoning,9.684606377141252e-07
Legal intervention involving unspecified explosives,9.684606377141252e-07
"Rheumatoid bursitis, ankle and foot",9.65701617272588e-07
allergy testing raspberry erythema,9.623030157285679e-07
"Displaced fracture of distal phalanx of right little finger, subsequent encounter for fracture with nonunion",9.564429701351577e-07
primary; persistent,9.37899007683192e-07
allergy testing walnut induration,9.378236842632492e-07
Trochlea fracture of humerus,9.378236842632492e-07
DIABETES MELLITUS NOS NEW ONSET,9.373815700710409e-07
ACRODYSOSTOSIS 2 WITH OR WITHOUT HORMONE RESISTANCE,9.373815700710409e-07
"Collision between animal being ridden and pedestrian, pedestrian conveyance or pedestrian vehicle",9.318174208181381e-07
Supraventricular tachycardia (& [paroxysmal] or [paroxysmal artrial]),9.318174208181381e-07
"c.puerperium; hypertension, pre-existing, essential (benign)",9.318174208181381e-07
excessive urination,9.318174208181381e-07
Intentional vindesine overdose,9.284655623721881e-07
allergy testing lodgepole pine erythema,9.284655623721881e-07
"Strain of intrinsic muscle, fascia and tendon of unspecified finger at wrist and hand level, initial encounter",9.218467532440283e-07
"Supranuclear Palsy, Progressive, 1, Atypical",9.208840754082276e-07
lower limb amputation at hip (injury),9.112329966435288e-07
"Osteophyte, shoulder",9.099329215531811e-07
grade 2 nodular sclerosing Hodgkin's lymphoma of cerebral ventricle,9.033627924303765e-07
Endophthalmitis of right eye,8.820350073336036e-07
Lumbar facet joint syndrome,8.735572182680768e-07
Childhood phobic anxiety disorder,8.669224831158308e-07
"Vertical strabismus, left eye",8.637865417788401e-07
"Displaced transcondylar fracture of left humerus, sequela",8.60339004344199e-07
Carcinoma in situ of lacrimal drainage system,8.573574157047792e-07
Stage IIIC Uterine Sarcoma AJCC v7,8.566347631859566e-07
deep third degree burns of trunk with loss of back including buttocks,8.563723348213958e-07
deep third degree burns of lower limb with loss of toes of left foot,8.49451535074575e-07
"Motor vehicle traffic accident involving collision between motor vehicle and tramcar, driver of motor vehicle injured",8.49451535074575e-07
Open wound: [lumbar region] or [flank without complication],8.37116750021717e-07
"Nonexudative age-related macular degeneration, left eye, advanced atrophic without subfoveal involvement",8.356358143589353e-07
Primidone overdose of undetermined intent,8.339453888078567e-07
Allergy to Arachis oil,8.305058843062711e-07
Mental concentration,8.274877206246327e-07
Prolonged rupture of membranes,8.274877206246327e-07
COMBINED OXIDATIVE PHOSPHORYLATION DEFICIENCY 11,8.267263472595759e-07
Rectosigmoid cancer in situ,8.196057432131733e-07
dizziness upon bending over,8.026964662467055e-07
"Calculus of gallbladder and bile duct with other cholecystitis, with obstruction",7.899779422282469e-07
"Legal intervention involving unspecified gas, bystander injured, initial encounter",7.898449031474013e-07
"Traumatic rupture of other ligament of left middle finger at metacarpophalangeal and interphalangeal joint, subsequent encounter",7.898449031474013e-07
Allergy to cortisone,7.89568269617837e-07
wound; lip,7.89568269617837e-07
External carotid artery calcification,7.857992661224661e-07
retina; change,7.801288408905302e-07
Allergy to protamine zinc insulin,7.76921444356043e-07
"Cognitive impairment, progressive",7.716306710932628e-07
Fetus at risk,7.688732968370927e-07
"Other fracture of occiput, left side, sequela",7.538240502039467e-07
Fracture of phalanx of index finger,7.533178059025058e-07
uterus; membranaceous,7.499646983257894e-07
Labyrinthitis ossificans,7.398511661301727e-07
"mediastinum; tuberculous, primary (progressive)",7.336992026607225e-07
"Obstructed labor due to breech presentation, fetus 5",7.315966089859856e-07
nasopharyngeal culture for Corynebacterium diphtheriae,7.315966089859856e-07
Aortitis in diseases classified elsewhere,7.315966089859856e-07
heterotopia; cerebral,7.315966089859856e-07
Eosinophilic meningoencephalomyelitis,7.299240591479931e-07
Displaced fracture (avulsion) of medial epicondyle of unspecified humerus,7.274210075553277e-07
benign neoplasm of cornea of left eye,7.264571738896114e-07
Red cell fragmentation syndrome,7.219193515981531e-07
radio-ulnar synostosis-short stature-microcephaly-scoliosis-mental retardation syndrome,7.178521634513097e-07
Allergy to food additive,7.178521634513097e-07
"DEAFNESS, AUTOSOMAL RECESSIVE 47 (disorder)",7.111897941700154e-07
"Puncture wound without foreign body, unspecified hip, subsequent encounter",7.103969048815976e-07
positive regulation of glial cell migration,7.049633521796225e-07
Subluxation of radiocarpal joint of unspecified wrist,7.026285642432285e-07
neoplasm of soft tissue of left foot,7.024949181352404e-07
Allergy to nitrofurazone,7.004320799192292e-07
Acquired disorder of neutrophil function,6.930809707078583e-07
Probability Learning,6.886091065945673e-07
"Chromosome 7, monosomy 7q21",6.866986636120432e-07
"Strain of unspecified muscle and tendon at ankle and foot level, unspecified foot",6.866986636120432e-07
"Diabetes with neurological manifestations, type II or unspecified type, uncontrolled",6.866986636120432e-07
Closed anterior subluxation,6.866986636120432e-07
Allergy to chlorhexidine,6.82171353717152e-07
inhibition of protein stabilization activity,6.794060073447526e-07
orthopedic disorders of spine,6.75622288114631e-07
"Congenital absence, atresia and stenosis of anus without fistula",6.731277852979418e-07
Primary progressive cerebellar degeneration,6.725315677168916e-07
"Chorioretinal scars after surgery for detachment, unspecified eye",6.626146590904479e-07
"Continuing pregnancy after spontaneous abortion of one fetus or more, first trimester, not applicable or unspecified",6.626146590904479e-07
"Esophageal disorder, vagal",6.514088259002032e-07
type 1 diabetes with diabetic peripheral angiopathy without gangrene,6.483721781306738e-07
Rhesus antibody absent,6.476861735275716e-07
Infected wound of left hip due to nonvenomous insect bite,6.308004860402038e-07
Regional enteritis,6.26020047687479e-07
"Nondisplaced fracture of distal phalanx of right index finger, subsequent encounter for fracture with routine healing",6.248474372751698e-07
"Amphetamine or other stimulant use disorder, moderate, with amphetamine or other stimulant intoxication, with perceptual disturbances",6.248474372751698e-07
Neural Tissue Damage,6.232634798697149e-07
Carnevale syndrome,6.232634798697149e-07
"hemorrhage; placenta, intrapartum",6.179821888518921e-07
Pregnancy associated gingivitis,6.179821888518921e-07
Accidental prednisone overdose,6.152787440815856e-07
Low QRS voltages in the precordial leads,6.142639664827026e-07
opioid-induced sleep disorder during withdrawal,6.123743925370069e-07
Neoplasm of uncertain or unknown behavior of other and unspecified sites,6.120882880595761e-07
"Inflammation due to internal prosthetic device,implant or graft",6.083256220194955e-07
Tinea pedis due to combined/concurrent infection,6.052812230558267e-07
Congenital anomaly of duodenum,6.046297885368491e-07
Ho Kaufman Mcalister syndrome,6.022623673202376e-07
type 2 diabetes with diabetic retinopathy with macular edema,6.013171995909501e-07
BENZTROPINE TOXICITY,5.999243895884633e-07
Fall from baby stroller,5.898456641912317e-07
"factor; psychic, in diseases classified elsewhere",5.861807715364293e-07
Intraoperative hemorrhage and hematoma of left eye and adnexa complicating other procedure,5.816499475346726e-07
cellulitis of right hand,5.815097459498754e-07
Periprosthetic fracture around other internal prosthetic joint,5.815097459498754e-07
crush injury of scapula,5.815097459498754e-07
Ataxia with febrile episodes,5.805316698001942e-07
"Nondisplaced fracture of distal phalanx of other finger, subsequent encounter for fracture with nonunion",5.796400293127973e-07
Sprain of tibiofibular ligament of unspecified ankle,5.791557214540305e-07
PtcO2,5.791557214540305e-07
Finding of drug level,5.791557214540305e-07
"Nontraffic accident involving collision between off-road motor vehicle,not snow vehicle, and another off-road motor vehicle,not snow vehicle, rider of animal or animal-drawn vehicle occupant injured",5.789886945163546e-07
"pelvic hematoma during delivery as postpartum condition, delivered during previous episode",5.766944336250217e-07
diffuse nodular histiocytic (NH) lymphoma of intra-abdominal lymph nodes,5.757793867729214e-07
"External constriction, left hip, subsequent encounter",5.73614843624409e-07
"Greenstick fracture of shaft of humerus, right arm, subsequent encounter for fracture with routine healing",5.721450050887764e-07
Ulnar nerve entrapment at right elbow,5.699673089654048e-07
"retardation; developmental, specific, motor function",5.699673089654048e-07
"Dependency on substances other than alcohol, nicotine, prescribed medications, or over-the-counter medications",5.661744457798388e-07
Allergy to misoprostol,5.622437454385154e-07
gliomatosis cerebri of cerebellum,5.621621002580698e-07
"Open bite, right ankle, sequela",5.615262725296617e-07
Allergy to naloxone,5.520172455861186e-07
"Follicular lymphoma grade III, unspecified, lymph nodes of multiple sites",5.491384138400413e-07
Infection by Syngamus trachea,5.491384138400413e-07
"Person on outside of three-wheeled motor vehicle injured in collision with pedal cycle in nontraffic accident, initial encounter",5.491384138400413e-07
closed fracture of right third rib,5.491384138400413e-07
gastric mucosa culture Cytomegalovirus,5.470245020720167e-07
Cerebelloparenchymal Disorder V,5.46918139979826e-07
NEURONAL CEROID LIPOFUSCINOSIS DUE TO CATHEPSIN D DEFICIENCY,5.466214408982734e-07
Typhoid meningitis,5.450625319794058e-07
Milch type I fracture,5.441342724432217e-07
Antidote allergy,5.389696447273718e-07
neoplasm of soft tissue of left knee,5.389696447273718e-07
"Motor vehicle nontraffic accident involving collision, not on public highway, between motor vehicle, except off-road motor vehicle, and pedestrian",5.335777460802851e-07
lumbar neuritis at L4-L5,5.321045664358418e-07
Arrhythmia &#x7C; Heart &#x7C; Impression,5.287065931011148e-07
open fracture of carpal bone of right wrist,5.287065931011148e-07
Preterm labor with preterm delivery,5.24703716168112e-07
"Injury of medial plantar nerve, left leg",5.148390424038798e-07
