Phenotype,Network_score
Disorders of lacrimal system in diseases classified elsewhere,7.171767072138494e-05
Follicle stimulating hormone level result,7.086796066345665e-05
"Maternal care for compound presentation, fetus 2",7.055277977042317e-05
"Auditory recruitment, right ear",7.008953597519582e-05
Allergy to fludrocortisone,7.008953597519582e-05
Allergy to enoxaparin,7.008953597519582e-05
Nondisplaced fracture (avulsion) of lateral epicondyle of right humerus,7.008953597519582e-05
Accidental prochlorperazine overdose,7.008953597519582e-05
"vagina; rupture, nonpuerperal, nontraumatic",7.008953597519582e-05
Subchondral insufficiency fracture of condyle of femur,7.008953597519582e-05
"Bipolar affective disorder, currently depressed, in partial or unspecified remission",6.980070801715147e-05
CHLORPHINE ALLERGY,6.979520638713891e-05
"Military operations involving intentional restriction of air and airway, military personnel, subsequent encounter",6.938956895772847e-05
pseudocirrhosis; pericardial,6.928831236271537e-05
"Tributary (branch) retinal vein occlusion, left eye, with macular edema",6.926344765681567e-05
trabecular adenocarcinoma of urethra,6.917812288821903e-05
Dissection of left renal artery,6.874980602737726e-05
late effects of nontraumatic subarachnoid hemorrhage ataxia,6.849383132511515e-05
lung transplant failure,6.836740037730511e-05
"Displaced fracture of epiphysis (separation) (upper) of left femur, subsequent encounter for open fracture type I or II with nonunion",6.805932694372553e-05
Red blood cell finding,6.793852317308745e-05
diabetes with diabetic peripheral angiopathy without gangrene,6.748784858035427e-05
HTLV-2 serology test positive,6.748723756072897e-05
"Airgun discharge, undetermined intent, sequela",6.716435833696098e-05
Congenital onychoatrophy,6.689025310349826e-05
closed rib fracture of left twelfth rib,6.677115399603309e-05
"Military operations involving unintentional restriction of air and airway, military personnel, initial encounter",6.671432742863687e-05
"Nontraffic accident involving fall from motor vehicle, except off-road motor vehicle, while in motion, not on public highway, pedal cyclist injured",6.611693429264453e-05
contusion with intact skin of lateral surface of right forearm,6.607143929831272e-05
Graft delamination,6.567707223029525e-05
"Maternal care for (suspected) fetal abnormality and damage, unspecified, fetus 5",6.567382532890215e-05
Resistance to infection,6.536035658236084e-05
Clostridium; cellulitis,6.533818456578371e-05
forgetting,6.512238039230586e-05
Laceration with foreign body of right lesser toe(s) without damage to nail,6.418868308015582e-05
Childhood emotional disorder,6.403438801477828e-05
"Nontraffic accident involving jump from motor vehicle, except off-road motor vehicle, while in motion, not on public highway, motor cyclist injured",6.384254150146991e-05
goblet cell carcinoid of digestive tract,6.341725124785404e-05
"Terrorism involving other explosions and fragments, terrorist injured, subsequent encounter",6.336466326287713e-05
cerebrospinal fluid culture Leptospira icterohaemorrhagiae,6.240638076565348e-05
neoplasm of peripheral nerves of knee,6.236932994113108e-05
Poisoning by venomous mollusc,6.221532280907766e-05
"Partial traumatic amputation of left foot, level unspecified, sequela",6.20790748495887e-05
slipped; sacroiliac joint,6.177848228057464e-05
"Idiopathic cysts of iris, ciliary body or anterior chamber, left eye",6.175112330645526e-05
"Infection of amniotic sac and membranes, unspecified, second trimester, fetus 2",6.157995662114664e-05
"Acute infarction of intestine, part unspecified",6.155480914923371e-05
tuberculous peritonitis TB in sputum: (+) microscopy,6.150679551639312e-05
"Idiopathic chronic gout, left elbow, without tophus (tophi)",6.136110423073674e-05
Post-op. problems,6.136006096252159e-05
giant cell glioblastoma of cerebral ventricle,6.116421840093713e-05
Perinatal gastrointestinal hemorrhage,6.109106356270771e-05
"Complete traumatic amputation of unspecified foot at ankle level, initial encounter",6.1063198238384e-05
open fracture of L2 vertebral body with spinal cord injury,6.082834024074858e-05
"Strain of intrinsic muscle, fascia and tendon of right thumb at wrist and hand level",6.059902535208185e-05
intraductal micropapillary carcinoma in situ of liver,6.046752156125203e-05
personality; chronic pain,6.030072885252604e-05
Allergy to sulfadimethoxine,6.020257578859706e-05
Allergy to prilocaine,6.0109440932470084e-05
"Profound mental retardation, significant impairment of behavior requiring attention or treatment",5.9897756027877325e-05
Accidental bismuth compound overdose,5.9846472532054815e-05
"DIABETES MELLITUS, INSULIN-DEPENDENT, 5",5.9846472532054815e-05
"Dislocation of proximal interphalangeal joint of left ring finger, subsequent encounter",5.9846472532054815e-05
Alcohol abuse,5.9846472532054815e-05
Radial deviation of the wrist,5.9846472532054815e-05
organic central sleep apnea in conditions classified elsewhere,5.935096870260087e-05
Extravasation injury,5.8841419852503554e-05
Instillation site hypoesthesia,5.866111371573764e-05
Alcoholic fibrosis and sclerosis of liver,5.820202840867185e-05
Spironolactone and loop diuretic adverse reaction,5.790602581260969e-05
Arrested hydrocephalus,5.7144262878179986e-05
Partial traumatic amputation of right hand at wrist level,5.684996837460989e-05
syndrome; Wilson,5.684162469872074e-05
renal calculus; with hydronephrosis and infection,5.668104109563823e-05
peripheral vision worsens during day,5.6148866506333616e-05
"Thrombocytosis, Autosomal Dominant",5.6100696447823174e-05
disseminated Salmonella gastroenteritis,5.598167149120449e-05
Meprobamate adverse reaction,5.568291815984632e-05
Delayed perforation of jejunum,5.558798946209468e-05
Circumflex artery stenosis,5.548741919555705e-05
Diamidine antiprotozoal adverse reaction,5.541482345235638e-05
Telangiectatic osteosarcoma recurrent,5.5131154227678e-05
Compulsive Personality,5.495853452777069e-05
"Maternal care for anti-D [Rh] antibodies, first trimester, not applicable or unspecified",5.4909249107359244e-05
Cardiovascular insufficiency,5.449880988439911e-05
Neoplastic Granulocytes and Precursors 20 Percent or More of Bone Marrow Cells,5.439553745045865e-05
"c.puerperium; hypertension, pre-existing, essential, with superimposed proteinuria",5.4291832094545663e-05
Winter Harding Hyde syndrome,5.414141895508521e-05
Cell count NOS CSF negative,5.412444597073793e-05
Palmoplantar Hyperkeratosis with Squamous Cell Carcinoma of Skin and Sex Reversal,5.371753167457084e-05
Calcific tendinitis of left hand,5.357422766369773e-05
"Complete traumatic amputation of right foot, level unspecified, initial encounter",5.3293751291167095e-05
Overdose of histamine H2-receptor antagonists,5.26090914370536e-05
Other disturbances of cerebral status of newborn,5.2372507896482635e-05
gastroenteritis due to Campylobacter coli,5.219088989709992e-05
Acquired arteriovenous malformation of the skin,5.20212466320033e-05
Methylene blue test passed,5.20212466320033e-05
Allergy to ancrod,5.20212466320033e-05
Adverse reaction to avomine,5.20212466320033e-05
galactosemia in newborn,5.20212466320033e-05
Fungus identified &#x7C; Aspirate &#x7C; Microbiology,5.20212466320033e-05
"Displaced fracture of distal phalanx of left lesser toe(s), sequela",5.20212466320033e-05
"Displaced comminuted fracture of shaft of humerus, unspecified arm",5.185994157099019e-05
Ovarian germ cell teratoma stage II A,5.1810981623952974e-05
"Follicular cyst of ovary, unspecified side",5.1810981623952974e-05
"War operations involving unintentional restriction of air and airway, civilian",5.1810981623952974e-05
"Tuberculosis of hip, unspecified examination",5.1810981623952974e-05
open fracture of left acetabulum with subluxation of anterior femoral head (alpha 1),5.1810981623952974e-05
Closed fracture of left pilon,5.180477543183932e-05
Other enthesopathy of unspecified foot and ankle,5.1752900798223924e-05
"Motor vehicle nontraffic accident involving collision, not on public highway, between motor vehicle, except off-road motor vehicle, and pedestrian, other specified person injured",5.119151940711012e-05
"c.delivery; retention of secundines, partial",5.059680110093335e-05
"Fetus-to-fetus placental transfusion syndrome, third trimester",5.0433983191895665e-05
"Laceration of unspecified muscle and tendon at ankle and foot level, left foot",5.0433983191895665e-05
Adverse reaction to hepatitis A vaccine,5.0433983191895665e-05
first degree burns of abdominal wall including flank and groin,5.0433983191895665e-05
immunologic disorders complicating puerperium,5.0227942202137585e-05
nodular sclerosing Hodgkin's lymphoma of intrahepatic bile duct,5.004499346717507e-05
"myocardium; insufficiency, rheumatic, active, acute or subacute",4.9985791181260545e-05
"Pedestrian on foot injured in collision with pedal cycle in nontraffic accident, initial encounter",4.959472597128451e-05
Ergot alkaloid adverse reaction,4.9339681145620996e-05
Hepatitis D RNA positive,4.9336454280839044e-05
Costocoracoid ligament congenitally short,4.9283208299658754e-05
DIAMOND-BLACKFAN ANEMIA 11,4.9244633205274365e-05
positive regulation of response to macrophage colony-stimulating factor,4.922708088816622e-05
Histoplasmosis of spinal cord,4.895930714430241e-05
Dementia with Down syndrome,4.850553641549968e-05
Monckeberg's arteriosclerosis with intermittent claudication,4.836356637748817e-05
"Displaced fracture of medial cuneiform of right foot, subsequent encounter for fracture with malunion",4.835280503396024e-05
"Partial traumatic amputation of unspecified foot, level unspecified",4.809148513138973e-05
"Nondisplaced fracture of middle phalanx of unspecified finger, initial encounter for open fracture",4.805140502929053e-05
"Nontraffic accident involving being hit by object thrown on motor vehicle, except off-road motor vehicle, while in motion, not on public highway, passenger on motor cycle injured",4.799245026937786e-05
peripheral neuroectodermal tumor of joint,4.79840032449335e-05
ganglion of fourth metatarsophalangeal joint of left foot,4.7461345181772914e-05
Recurrent Malignant Myoepithelioma,4.738727773472111e-05
invasion of other organism,4.731874741718502e-05
Other displaced fracture of upper end of left humerus,4.6925944059521674e-05
Hematoma of left lower leg,4.672312465685222e-05
Accidental ingestion of white bryony berries,4.6700579071109074e-05
Against-the-rule astigmatism,4.6654407275135327e-05
"Retinopathy of prematurity, stage 1, right eye",4.623303073763257e-05
trabecular adenocarcinoma of ureter,4.59271226348912e-05
Thrown from animal-drawn vehicle,4.586629496060841e-05
Novel Mutation,4.5832727777216914e-05
pressure-induced deep tissue damage of left upper back,4.563044796482163e-05
intravesical; hemorrhage,4.526006428234452e-05
Bilateral cystoid macular edema of eyes due to and following cataract surgery,4.4940680400821344e-05
CHEST PAIN RULE OUT PULMONARY EMBOLISM,4.487817923267727e-05
"Maternal care for anti-D [Rh] antibodies, unspecified trimester, fetus 2",4.45737594947732e-05
Testosterone implant adverse reaction,4.4439373241798145e-05
"Terrorism involving nuclear weapons, public safety official injured, subsequent encounter",4.4397380897924735e-05
"Strain of flexor muscle, fascia and tendon of right middle finger at wrist and hand level, sequela",4.435324369810409e-05
"Displaced segmental fracture of shaft of humerus, left arm, initial encounter for closed fracture",4.431775197000263e-05
Intermittent double-step gait,4.395486375895521e-05
ocular; myiasis (manifestation),4.39429817292876e-05
"Chronic gout due to renal impairment, unspecified site, without tophus (tophi)",4.374081406276267e-05
Flash pulmonary oedema,4.3672284690621105e-05
Benign tumor of mesothelial tissue,4.337124129686389e-05
Mucopolysaccharidosis VII,4.3297438310975936e-05
Non-arthropod-borne viral disease associated with AIDS,4.301802501228331e-05
Clostridium bacteremia,4.293947267318263e-05
"Macular keratitis, bilateral",4.260050087337486e-05
"Poisoning by other anti-common-cold drugs, intentional self-harm",4.224063993429954e-05
"Spastic paraplegia 8, autosomal dominant",4.220644011239885e-05
diabetes mellitus secondary with hyperglycemia,4.199065070226465e-05
Crushing injury of vertebral region,4.199065070226465e-05
Hemangioblastic Meningioma,4.199065070226465e-05
"Unspecified motorcycle rider injured in collision with two- or three-wheeled motor vehicle in nontraffic accident, subsequent encounter",4.1486664015700107e-05
"Unspecified B-cell lymphoma, lymph nodes of inguinal region and lower limb",4.1262266246592765e-05
"Subluxation of other carpometacarpal joint of unspecified hand, subsequent encounter",4.07554914360197e-05
"hay fever; catarrh, with asthma",4.0546616872382014e-05
Limbal stem cell deficiency,4.050303730750702e-05
Impaired executive functioning,4.043988797596284e-05
"nasal septum; injury, superficial",4.024339331619165e-05
first-degree perineal laceration during delivery involving labia,4.019642095733827e-05
"Displaced midcervical fracture of left femur, subsequent encounter for open fracture type I or II with nonunion",3.907907598114176e-05
"Idiopathic chronic gout, unspecified hip, without tophus (tophi)",3.8843147487333355e-05
Calculus core,3.857923532651948e-05
Deleterious FBXW7 Gene Mutation,3.842389176003456e-05
"Other myositis, right ankle and foot",3.820954986270616e-05
Postprocedural hematoma and seroma of skin and subcutaneous tissue following a procedure,3.787715109073824e-05
Ovarian germ cell teratoma stage I C,3.7729325007656425e-05
Loose or sagging skin following dietary weight loss,3.7728151232435214e-05
Large cell carcinoma of the respiratory tract stage III,3.771233990681454e-05
Injection site subcutaneous fatty hypertrophy,3.771080160424075e-05
Gangrenous appendicitis,3.7437829432477474e-05
persistent cyanosis,3.739775897891857e-05
"Tuberculosis of other urinary organs, tubercle bacilli found (in sputum) by microscopy",3.7323996210282576e-05
"Person boarding or alighting a three-wheeled motor vehicle injured in collision with car, pick-up truck or van",3.7177887714196856e-05
COFFIN-SIRIS SYNDROME 4,3.712664429493765e-05
"Crushing injury of right thumb, subsequent encounter",3.7068953495085776e-05
Malassez,3.672022578683648e-05
"Nondisplaced midcervical fracture of unspecified femur, subsequent encounter for open fracture type I or II with malunion",3.662388757984496e-05
"Displaced fracture of distal phalanx of right great toe, subsequent encounter for fracture with nonunion",3.662388757984496e-05
"Other disorders of optic nerve, not elsewhere classified, unspecified eye",3.6591984179178674e-05
"Vertebral artery compression syndromes, occipito-atlanto-axial region",3.647194858885668e-05
Cardiac cirrhosis,3.60745809420874e-05
"Unspecified injury of flexor muscle, fascia and tendon of left index finger at wrist and hand level, sequela",3.605879321378722e-05
Accidental phenobarbitone overdose,3.598199636480869e-05
Central nervous system lesion,3.595536537281749e-05
fetal thrombocytopenia with baby delivered,3.591226972353458e-05
Steroid-induced cardiomyopathy,3.587848124663221e-05
"pregnancy; multiple, complicated",3.57965655117655e-05
"Nondisplaced fracture of intermediate cuneiform of left foot, subsequent encounter for fracture with delayed healing",3.5719940948585793e-05
"Filamentary keratitis, unspecified eye",3.561944069070653e-05
FALL RELATED INJURY,3.548737006053512e-05
Decreased IQ,3.529512244612864e-05
Inflammatory disorder of optic radiation,3.5285563692753714e-05
"Nontraffic accident involving injury by being thrown against part of,or object in, moving motor vehicle, except off-road vehicle, not on highway, passenger on motor cycle injured",3.50643094939213e-05
postprocedural hemorrhage of skin and subcutaneous tissue,3.504926460859888e-05
Reardon Wilson Cavanagh syndrome,3.5007494289721484e-05
"Nontraffic accident involving jump from motor vehicle, except off-road motor vehicle, while in motion, not on public highway, passenger on motor cycle injured",3.4906773886189426e-05
Hirschsprung disease 1,3.490142831265279e-05
monoarticular inflammation of forearm,3.488392342312509e-05
"Nondisplaced fracture of middle phalanx of left middle finger, initial encounter for closed fracture",3.483490547905726e-05
Palate weakness,3.483490547905726e-05
Allergy to formaldehyde,3.483490547905726e-05
Orbivirus infection,3.483490547905726e-05
"Other disorders of optic nerve, not elsewhere classified, bilateral",3.483490547905726e-05
"Labor and delivery complicated by other cord entanglement, with compression, fetus 1",3.483490547905726e-05
Intentional dacarbazine overdose,3.483490547905726e-05
Other specified disorders of left external ear,3.483490547905726e-05
Sputum: pus cells present,3.4730447692207065e-05
Tinea corporis due to Trichophyton verrucosum,3.465668382909023e-05
"Fracture of coronoid process of right mandible, initial encounter for closed fracture",3.455639033916252e-05
Complicated infection,3.45273667703465e-05
Warty (Bowenoid) Penile Intraepithelial Neoplasia,3.451212537167393e-05
Allergy to pyrantel,3.449722617183441e-05
gunshot wound of right middle finger,3.44489975739943e-05
Infection of skin of neck,3.438130313440885e-05
"Dislocation of proximal interphalangeal joint of right middle finger, sequela",3.412114971766112e-05
Cyanosis of skin over lesion,3.412114971766112e-05
retroperitoneal; inflammation,3.409414329969719e-05
LEFT VENTRICULAR NONCOMPACTION 7,3.409414329969719e-05
"Erythema nodosum with hypersensitivity reaction in tuberculosis, tubercle bacilli not found by bacteriological examination, but tuberculosis confirmed histologically",3.396851629742486e-05
penicillamine poisoning with undetermined intent,3.3754545091550526e-05
Oesophageal squamous cell carcinoma upper third stage III,3.372406861462624e-05
Chondrodystrophy malacia,3.372406861462624e-05
"Fracture of unspecified part of neck of right femur, initial encounter for open fracture type I or II",3.372406861462624e-05
pain; nasopharynx,3.372406861462624e-05
Superficial thrombophlebitis in puerperium,3.3658084294536875e-05
Birth Control Related Concern,3.337844400161068e-05
"Preterm labor second trimester with preterm delivery third trimester, not applicable or unspecified",3.3154090077214806e-05
Recurrent Malignant Ovarian Granulosa Cell Tumor,3.312246692685881e-05
Myeloid and/or lymphoid neoplasm associated with platelet derived growth factor receptor alpha rearrangement,3.2774793104017595e-05
Mitral sub-valve apparatus calcification,3.265847083443647e-05
"Other fracture of occiput, unspecified side, subsequent encounter for fracture with routine healing",3.256924810360099e-05
Petit mal status,3.256107598489005e-05
Hematoma of dialysis access site,3.251437595847342e-05
Pelvic sepsis,3.2454295441646806e-05
"Nondisplaced fracture of proximal phalanx of right middle finger, sequela",3.231926378765331e-05
Erosion of enamel,3.231926378765331e-05
"Legal intervention involving injury by dynamite, law enforcement official injured",3.231926378765331e-05
Squamous Cell Carcinoma of the Mouse Pharynx,3.231926378765331e-05
"Unspecified fracture of unspecified toe(s), subsequent encounter for fracture with nonunion",3.231926378765331e-05
Allergy to Vinca alkaloid,3.231926378765331e-05
Urine leukocyte test negative,3.231926378765331e-05
"Chronic instability of knee, right knee",3.231926378765331e-05
COCAINE ABUSE DAILY,3.231926378765331e-05
"Craniometaphyseal dysplasia, autosomal recessive type",3.231926378765331e-05
"injury, poisoning, and certain consequences of external causes complicating puerperium",3.231926378765331e-05
cysticercosis; central nervous system (manifestation),3.2215929470130035e-05
Diffuse mixed small and large cell lymphoma (Angioimmunoblastic T-cell lymphoma) stage I,3.220678848664286e-05
Vulvar Alveolar Soft Part Sarcoma,3.212475592382241e-05
Accidental ibuprofen overdose,3.2056155064828524e-05
Hepatic artery embolism,3.199481982580279e-05
Carbonic anhydrase II gene mutation,3.19453982210959e-05
"hemorrhage; gastrointestinal tract, newborn",3.19453982210959e-05
Feeling nervous,3.194450945748617e-05
Azoospermia due to drug,3.190098093687946e-05
Adverse reaction to other antihypertensives,3.1846680918831736e-05
annular; incompetency aortic valve,3.182506357723191e-05
"Abscess of tendon sheath, right ankle and foot",3.1813559030225996e-05
congenital absence of right ear lobe,3.1795775800669064e-05
"Nondisplaced unspecified fracture of left great toe, initial encounter for closed fracture",3.171811236075459e-05
Cauliflower deformity of dermal collagen fibrils,3.171811236075459e-05
Brachydactylous dwarfism Mseleni type,3.171811236075459e-05
High ventilation-perfusion ratio,3.171811236075459e-05
"Traumatic rupture of volar plate of left little finger at metacarpophalangeal and interphalangeal joint, subsequent encounter",3.171811236075459e-05
Gastric Stenosis,3.166236487227038e-05
acinar cell cystadenocarcinoma of breast,3.104514183553818e-05
bone neoplasm of costovertebral joint of ninth rib,3.1024702776825077e-05
"Macular keratitis, left eye",3.100733769244797e-05
"Military operations involving other explosions and fragments, military personnel, subsequent encounter",3.100733769244797e-05
"Prosthetic and other implants, materials and accessory anesthesiology devices associated with adverse incidents",3.094467667176532e-05
tuberculosis of medulla bacteriology and histology not done,3.080616222315235e-05
"Subluxation of distal interphalangeal joint of other finger, initial encounter",3.03244122109127e-05
Reunion Island Larsen-like syndrome,3.0210804773573188e-05
Testicular germ cell tumor mixed incl yolk sac tumor stage I,3.004773935171101e-05
"Strain of intrinsic muscle, fascia and tendon of unspecified finger at wrist and hand level, sequela",2.9991306438627313e-05
(Chronic cor pulmonale) or (pulmonary heart disease NOS),2.9901137313462044e-05
"Unspecified amblyopia, unspecified eye",2.9831766613194206e-05
Creatinine urine abnormal,2.9831766613194206e-05
Adverse reaction to anti-infective substance,2.9823247443583417e-05
penile lump mid-shaft on right side,2.9809514056840113e-05
"Laceration of intrinsic muscle, fascia and tendon of left index finger at wrist and hand level, sequela",2.9717998226730307e-05
toxic maculopathy of left eye,2.9690325964869197e-05
nodular sclerosing Hodgkin's lymphoma in cellular phase of renal pelvis,2.9658512269176703e-05
Focal suppurative nephritis,2.95569873608063e-05
Infection due to ESBL bacteria,2.9322276570417872e-05
Autoimmune blistering disease,2.9187146120640368e-05
BRONCHOGENIC CANCER ADENOCARCINOMA,2.917034169883512e-05
phlebitis of the dorsal surface of the femoral vein,2.9125017088589895e-05
Postprocedural hematoma and seroma of an endocrine system organ or structure,2.892251191139104e-05
"Pedestrian on skateboard injured in collision with railway train or railway vehicle in nontraffic accident, initial encounter",2.892251191139104e-05
skin lesion KOH preparation fungi,2.892251191139104e-05
Stain remover causing toxic effect,2.8918865505528375e-05
"Acquired stenosis of external ear canal, unspecified, bilateral",2.889016802477989e-05
adenocarcinoma in situ in villous adenoma of penis,2.8854982229627415e-05
"Unspecified open-angle glaucoma, indeterminate stage",2.8854982229627415e-05
Type II arteriovenous malformation of spinal cord,2.88426494814586e-05
False labor,2.8821761155613345e-05
Pulmonary microemboli,2.8741073005647837e-05
contusion with intact skin surface of right foot lateral surface,2.872356125367355e-05
"Motor vehicle traffic accident involving collision, on highway, between motor vehicle and fallen stone, traffic sign, tree or utility pole, motor cyclist injured",2.8432861815190163e-05
"wound; chest, back",2.8184340594175503e-05
ala nasi; melanoma,2.809743989540869e-05
Organizing pneumonia due to collagen vascular disease,2.809206216002659e-05
Phoneme-grapheme conversion deficit,2.8033377919950296e-05
growth on lower eyelid of left eye,2.778912322853728e-05
Benign neoplasm of left lacrimal gland and duct,2.751763948232595e-05
Hereditary Myopathy with Early Respiratory Failure,2.7361063747627668e-05
Agitation,2.7259612766460743e-05
"uterine cancer, stage I",2.71974668499279e-05
Secondary osteoarthritis of other joints,2.7146489179188612e-05
prenatal chemical exposure,2.7087045920591602e-05
"Sprain of interphalangeal joint of right great toe, subsequent encounter",2.7087045920591602e-05
contusion with intact skin of buttocks,2.693207268407738e-05
Chronic endophthalmitis of right eye,2.665524958535415e-05
Struck by missile,2.6610762194887813e-05
tuberculoma of spinal cord TB (+) other way (-) bacteriology (-) histology,2.6576806899970276e-05
growth on both lower eyelids,2.6233066936603956e-05
Flupenthixol adverse reaction,2.6176884946907686e-05
Vessel puncture site bruise,2.6176884946907686e-05
Double athetosis,2.5730252779402474e-05
Trandolapril adverse reaction,2.5719908086200564e-05
"Tuberculosis of other urinary organs, tubercle bacilli not found by bacteriological or histological examination, but tuberculosis confirmed by other methods [inoculation of animals]",2.5524049473460107e-05
"uterus; malposition, congenital",2.5524049473460107e-05
Demeclocycline adverse reaction,2.5216621401477556e-05
androgen independent prostate cancer,2.5210461636039526e-05
Antimicrobial activity,2.5092673566183125e-05
Mucinous colorectal carcinoma,2.4775456220943215e-05
Absence of hormonal activity,2.4727640634626608e-05
Liver opacity,2.4727640634626608e-05
Allergy to procarbazine,2.462159224214228e-05
allergy testing tea induration,2.461440668400957e-05
hallux rigidus of right foot,2.4542176080819687e-05
Benign neoplasm of right lacrimal gland,2.4478232677030934e-05
"Follicular lymphoma grade IIIa, lymph nodes of multiple sites",2.4473343509234e-05
